{
  "$schema": "https://json-schema.org/draft/2020-12/schema",
  "$id": "https://github.com/amamujee/burrow/content/packs/pack.schema.json",
  "title": "Burrow Pack",
  "type": "object",
  "additionalProperties": false,
  "required": ["id", "title", "summary", "audience", "sources", "cards"],
  "properties": {
    "$schema": {
      "type": "string"
    },
    "id": {
      "type": "string",
      "pattern": "^[a-z0-9]+(?:-[a-z0-9]+)*$"
    },
    "title": {
      "type": "string",
      "minLength": 2
    },
    "summary": {
      "type": "string",
      "minLength": 20
    },
    "dataNote": {
      "type": "string",
      "minLength": 20
    },
    "primaryStat": {
      "type": "object",
      "additionalProperties": false,
      "required": [
        "id",
        "label"
      ],
      "properties": {
        "id": {
          "type": "string",
          "pattern": "^[a-z0-9]+(?:-[a-z0-9]+)*$"
        },
        "label": {
          "type": "string",
          "minLength": 2
        }
      }
    },
    "status": {
      "type": "string",
      "enum": ["draft", "needs-review", "playable"]
    },
    "audience": {
      "type": "object",
      "additionalProperties": false,
      "required": ["minAge", "maxAge"],
      "properties": {
        "minAge": {
          "type": "integer",
          "minimum": 2
        },
        "maxAge": {
          "type": "integer",
          "minimum": 2
        },
        "readingLevel": {
          "type": "string"
        }
      }
    },
    "recommendedModes": {
      "type": "array",
      "minItems": 1,
      "items": {
        "type": "string",
        "enum": ["quiz", "versus", "trumps", "sort", "fact", "peek", "number", "odd", "geo"]
      },
      "uniqueItems": true
    },
    "landing": {
      "type": "object",
      "additionalProperties": false,
      "required": ["detail", "image", "order"],
      "properties": {
        "title": {
          "type": "string",
          "minLength": 2,
          "maxLength": 32
        },
        "detail": {
          "type": "string",
          "minLength": 2,
          "maxLength": 48
        },
        "image": {
          "type": "string",
          "pattern": "^/burrow-assets/.+"
        },
        "imageFit": {
          "type": "string",
          "enum": ["cover", "contain"]
        },
        "order": {
          "type": "integer",
          "minimum": 1,
          "maximum": 999
        }
      }
    },
    "sources": {
      "type": "array",
      "minItems": 1,
      "items": {
        "type": "object",
        "additionalProperties": false,
        "required": ["label", "url"],
        "properties": {
          "label": {
            "type": "string",
            "minLength": 2
          },
          "url": {
            "type": "string",
            "format": "uri"
          },
          "note": {
            "type": "string"
          }
        }
      }
    },
    "cards": {
      "type": "array",
      "minItems": 8,
      "items": {
        "type": "object",
        "additionalProperties": false,
        "required": ["id", "name", "image", "imageAlt", "imageCredit", "imageSourceUrl", "fact", "stats", "categories"],
        "properties": {
          "id": {
            "type": "string",
            "pattern": "^[a-z0-9]+(?:-[a-z0-9]+)*$"
          },
          "name": {
            "type": "string",
            "minLength": 2
          },
          "image": {
            "type": "string",
            "pattern": "^/burrow-assets/.+"
          },
          "imageAlt": {
            "type": "string",
            "minLength": 2
          },
          "imageCredit": {
            "type": "string",
            "minLength": 2
          },
          "imageSourceUrl": {
            "type": "string",
            "format": "uri"
          },
          "fact": {
            "type": "string",
            "minLength": 32
          },
          "stats": {
            "type": "array",
            "minItems": 2,
            "items": {
              "type": "object",
              "additionalProperties": false,
              "required": ["id", "label", "value", "unit"],
              "properties": {
                "id": {
                  "type": "string",
                  "pattern": "^[a-z0-9]+(?:-[a-z0-9]+)*$"
                },
                "label": {
                  "type": "string",
                  "minLength": 2
                },
                "value": {
                  "type": "number"
                },
                "unit": {
                  "type": "string"
                },
                "display": {
                  "type": "string",
                  "minLength": 1
                },
                "direction": {
                  "type": "string",
                  "enum": ["higher", "lower"]
                },
                "note": {
                  "type": "string"
                }
              }
            }
          },
          "categories": {
            "type": "array",
            "minItems": 1,
            "items": {
              "type": "string",
              "minLength": 2
            },
            "uniqueItems": true
          },
          "tags": {
            "type": "array",
            "items": {
              "type": "string",
              "pattern": "^[a-z0-9]+(?:-[a-z0-9]+)*$"
            },
            "uniqueItems": true
          },
          "metadata": {
            "type": "object",
            "additionalProperties": false,
            "properties": {
              "difficultyBand": {
                "type": "string",
                "enum": ["easy", "medium", "hard"]
              },
              "recognition": {
                "type": "integer",
                "minimum": 1,
                "maximum": 5
              },
              "rarity": {
                "type": "string",
                "enum": ["common", "uncommon", "rare", "epic"]
              },
              "flavorGrade": {
                "type": "string",
                "enum": ["A", "B", "C", "D"]
              },
              "pepperTypes": {
                "type": "array",
                "minItems": 1,
                "items": {
                  "type": "string",
                  "minLength": 2
                },
                "uniqueItems": true
              },
              "taxonomyGroup": {
                "type": "string",
                "minLength": 2
              },
              "accuracyNote": {
                "type": "string",
                "minLength": 8
              },
              "sources": {
                "type": "array",
                "minItems": 1,
                "items": {
                  "type": "object",
                  "additionalProperties": false,
                  "required": ["label", "url"],
                  "properties": {
                    "label": { "type": "string", "minLength": 2 },
                    "url": { "type": "string", "format": "uri", "pattern": "^https?://" },
                    "note": { "type": "string", "minLength": 1 }
                  }
                }
              },
              "imageDistinctGroup": {
                "type": "string",
                "pattern": "^[a-z0-9]+(?:-[a-z0-9]+)*$"
              },
              "location": {
                "type": "object",
                "additionalProperties": false,
                "required": ["label", "countries", "continents"],
                "properties": {
                  "label": {
                    "type": "string",
                    "minLength": 2
                  },
                  "countries": {
                    "type": "array",
                    "minItems": 1,
                    "items": {
                      "type": "string",
                      "minLength": 2
                    },
                    "uniqueItems": true
                  },
                  "continents": {
                    "type": "array",
                    "minItems": 1,
                    "items": {
                      "type": "string",
                      "enum": ["Africa", "Antarctica", "Asia", "Europe", "North America", "South America", "Oceania"]
                    },
                    "uniqueItems": true
                  },
                  "coordinates": {
                    "type": "array", "minItems": 2, "maxItems": 2,
                    "prefixItems": [{ "type": "number", "minimum": -90, "maximum": 90 }, { "type": "number", "minimum": -180, "maximum": 180 }]
                  },
                  "states": {
                    "type": "array", "minItems": 1, "uniqueItems": true,
                    "items": { "type": "string", "minLength": 2 }
                  }
                }
              }
            }
          },
          "details": {
            "type": "array",
            "items": {
              "type": "object",
              "additionalProperties": false,
              "required": [
                "label",
                "value"
              ],
              "properties": {
                "label": {
                  "type": "string",
                  "minLength": 2
                },
                "value": {
                  "type": "string",
                  "minLength": 1
                }
              }
            }
          },
          "readingPrompts": {
            "type": "array",
            "items": {
              "type": "string",
              "minLength": 12
            }
          }
        }
      }
    }
  },
  "allOf": [
    {
      "if": {
        "properties": {
          "status": {
            "const": "playable"
          }
        },
        "required": ["status"]
      },
      "then": {
        "required": ["landing", "recommendedModes"]
      }
    }
  ]
}
