{
  "$schema": "../pack.schema.json",
  "id": "new-pack-id",
  "title": "New Pack Title",
  "summary": "One sentence about the kid obsession this pack turns into reading and math games.",
  "status": "draft",
  "audience": {
    "minAge": 5,
    "maxAge": 9,
    "readingLevel": "short facts, parent-approved vocabulary"
  },
  "recommendedModes": ["quiz", "versus", "trumps", "sort", "fact", "peek", "number", "odd", "geo"],
  "landing": {
    "detail": "what players compare and discover",
    "image": "/burrow-assets/new-pack-id/example-card.jpg",
    "imageFit": "cover",
    "order": 100
  },
  "sources": [
    {
      "label": "Source name",
      "url": "https://example.com/source",
      "note": "Use sources with clear rights and facts a parent can audit."
    }
  ],
  "cards": [
    {
      "id": "example-card",
      "name": "Example Card",
      "image": "/burrow-assets/new-pack-id/example-card.jpg",
      "imageAlt": "Example Card",
      "imageCredit": "Photographer or source name",
      "imageSourceUrl": "https://example.com/source-image",
      "fact": "Write one short, concrete fact that a kid can read and a parent can verify.",
      "metadata": {
        "difficultyBand": "medium",
        "taxonomyGroup": "example category",
        "accuracyNote": "Explain the measurement basis, date, variant and any uncertainty. Label editorial game ratings explicitly.",
        "sources": [
          {
            "label": "Factual reference for this subject",
            "url": "https://example.com/factual-reference",
            "note": "Identify which facts and measurements this reference supports; keep image rights in imageCredit and imageSourceUrl."
          }
        ]
      },
      "stats": [
        {
          "id": "size",
          "label": "Size",
          "value": 10,
          "unit": "ft",
          "direction": "higher"
        },
        {
          "id": "speed",
          "label": "Speed",
          "value": 25,
          "unit": "mph",
          "direction": "higher"
        }
      ],
      "categories": ["example category"],
      "readingPrompts": [
        "What is one detail you noticed in the fact?"
      ]
    }
  ]
}
